{
  "$schema": "../schemas/payload-manifest.schema.json",
  "schema_version": "aiyuehan-workbench.r0-payload-manifest/v1",
  "manifest_id": "aiyuehan-workbench-gov0-r0-proposal-v4",
  "scope": "GOV-0/R0",
  "status": "PENDING_FORMAL_APPROVAL",
  "effective": false,
  "generated_at": "2026-08-29T17:39:09Z",
  "repository": {
    "owner": "cindywheele97-art",
    "name": "AIyuehan-workbench",
    "visibility": "public",
    "expected_url": "https://github.com/cindywheele97-art/AIyuehan-workbench",
    "remote_state": "PUBLIC_PROTECTED_GOVERNANCE_PROPOSAL",
    "repository_numeric_id": 1350747678,
    "default_branch": "main"
  },
  "source_design": {
    "path": "AIyuehan-workbench-architecture-and-development-plan-v1.2.md",
    "sha256": "be60ffbd9573b00b26e186295064a55dc255eaec05b7ca7ebc6cf70001b65274"
  },
  "digest_profile": {
    "entry_bytes": "exact_git_blob_bytes",
    "record_canonicalization": "RFC8785 / aiyuehan-workbench-restricted-ijson-v1",
    "algorithm": "sha256"
  },
  "closed_world": true,
  "entries_order": "path_bytewise_ascending",
  "entries": [
    {
      "path": ".github/CODEOWNERS",
      "bytes": 270,
      "sha256": "4fcaffc6237b79aadb1b679b79e2ef87de93e83be3025345a02d833092318557",
      "media_type": "text/plain",
      "role": "repository_metadata"
    },
    {
      "path": ".gitignore",
      "bytes": 125,
      "sha256": "121debc34e32a1b1ae08ae089fb64260663a8ffd0f60466a174ad6fbdbed7d91",
      "media_type": "text/plain",
      "role": "repository_metadata"
    },
    {
      "path": "AIyuehan-workbench-architecture-and-development-plan-v1.2.md",
      "bytes": 96001,
      "sha256": "be60ffbd9573b00b26e186295064a55dc255eaec05b7ca7ebc6cf70001b65274",
      "media_type": "text/markdown",
      "role": "architecture_baseline"
    },
    {
      "path": "CONTEXT.md",
      "bytes": 13296,
      "sha256": "fed5be9b1c7bae87d3eebcd8868131a9f2bb7c90f075c4b3d42b9e1f0c457199",
      "media_type": "text/markdown",
      "role": "domain_model"
    },
    {
      "path": "README.md",
      "bytes": 1304,
      "sha256": "9941a6f9a4c588e89cfa9396e76f03137efeae7727bb3ed9712ffdc5ed9acc56",
      "media_type": "text/markdown",
      "role": "repository_metadata"
    },
    {
      "path": "docs/adr/0001-workbench-authority-external-platform-projection.md",
      "bytes": 1223,
      "sha256": "93c88d1da87ae68324128eefba086e11700c14eb13650f2eb16a72022b4e1c9e",
      "media_type": "text/markdown",
      "role": "architecture_decision"
    },
    {
      "path": "docs/adr/0002-gate-authority-owns-stage-promotion.md",
      "bytes": 966,
      "sha256": "ccee42ce1885135953711f016cb5c3b626c426d1b4150a38b299d193ae01d5a4",
      "media_type": "text/markdown",
      "role": "architecture_decision"
    },
    {
      "path": "docs/adr/0003-separate-projection-execution-and-effect-lifecycle.md",
      "bytes": 1065,
      "sha256": "9fff2fcb315dd4a7216f60695397eff66c5ea1c90124751a93bdc843914b9048",
      "media_type": "text/markdown",
      "role": "architecture_decision"
    },
    {
      "path": "docs/adr/0004-execution-grant-precedes-real-execution.md",
      "bytes": 1458,
      "sha256": "19d00af854d14ce45dc8cd5751ace1e0a055c0e589b98dc0ffcbb42cd58727a1",
      "media_type": "text/markdown",
      "role": "architecture_decision"
    },
    {
      "path": "docs/adr/0005-shared-kernel-isolated-customer-instances.md",
      "bytes": 1428,
      "sha256": "858238fb2260930a0cae714472cb06c5154feafd12f24798b02950a9874a5e82",
      "media_type": "text/markdown",
      "role": "architecture_decision"
    },
    {
      "path": "docs/adr/0006-governing-gate-definition-precedes-candidate.md",
      "bytes": 1275,
      "sha256": "217d0ca11fa87b1ed60f02b5bf3b8fe7a0e3191cb6f2998300d97c8011d74d5a",
      "media_type": "text/markdown",
      "role": "architecture_decision"
    },
    {
      "path": "docs/adr/0007-deployment-instance-contains-workspaces.md",
      "bytes": 1122,
      "sha256": "dcd7fc3150916f24dc20c965e210bd5ef5246b0ac052c567a2d1f3e130c2fdef",
      "media_type": "text/markdown",
      "role": "architecture_decision"
    },
    {
      "path": "docs/adr/0008-two-phase-governing-tag-publication.md",
      "bytes": 5539,
      "sha256": "99b610b7ad2194a41f0e5899664d64706a3334692bd2f98d37b677f337060aa0",
      "media_type": "text/markdown",
      "role": "architecture_decision"
    },
    {
      "path": "governance/README.md",
      "bytes": 4087,
      "sha256": "ca1f01fe4ba8c9425b41c18ff7af97dc163bd6269d6c28dde5ac7509ce5eecd0",
      "media_type": "text/markdown",
      "role": "governance_status"
    },
    {
      "path": "governance/authorizations/R0-AIYUEHAN-NAMESPACE-AUTHORIZATION.json",
      "bytes": 2805,
      "sha256": "92d13fa5ec959e0a7b810b03e0373f4caebe1b85ce95f609e60384cdf5dfef16",
      "media_type": "application/json",
      "role": "governance_policy"
    },
    {
      "path": "governance/authorizations/R0-PUBLIC-CONTINUATION-AUTHORIZATION.json",
      "bytes": 1935,
      "sha256": "bbb84330439fd4677e4dfc5bb09bab7b0ac657536ecbb7206f47e75067107169",
      "media_type": "application/json",
      "role": "governance_policy"
    },
    {
      "path": "governance/build/BUILD-LOG-EVIDENCE-INDEX.json",
      "bytes": 3042,
      "sha256": "21f0c04be395b9af88d7ebdc8278ba6dc34cdc0c3ea59cbb3b1af025ee0678ac",
      "media_type": "application/json",
      "role": "governance_log"
    },
    {
      "path": "governance/build/BUILD-LOG.ndjson",
      "bytes": 3723,
      "sha256": "0be07a69f03dc6deef6fe2fac9524bba1af393c81c38130ca19dfe71ee00a3cd",
      "media_type": "application/x-ndjson",
      "role": "governance_log"
    },
    {
      "path": "governance/evidence/EXTERNAL-LINEAGE.md",
      "bytes": 1060,
      "sha256": "289b75eb42785b8296c5ecb30e78b8f9792565cfb68e7882d8c60537662549c4",
      "media_type": "text/markdown",
      "role": "governance_evidence"
    },
    {
      "path": "governance/evidence/EXTERNAL-SOURCE-DIGESTS.sha256",
      "bytes": 297,
      "sha256": "8b2477b2b8f7904d450ab7b2f753b9ea857f6287bcc62cc049db4fe77c755146",
      "media_type": "text/plain",
      "role": "governance_evidence"
    },
    {
      "path": "governance/evidence/GITHUB-PUBLIC-PROTECTION-ADMIN-READBACK-AIYUEHAN.md",
      "bytes": 2093,
      "sha256": "08447dfd15c09423d69e9febcbd7d92daa666af462e3857b6895c11d169971f8",
      "media_type": "text/markdown",
      "role": "governance_evidence"
    },
    {
      "path": "governance/evidence/THIRD-PARTY-CODE-EXCLUSION.md",
      "bytes": 1047,
      "sha256": "088cf8d37397d5d29443511f779217148745e329d102adf6a05c20a2a2c0a524",
      "media_type": "text/markdown",
      "role": "governance_evidence"
    },
    {
      "path": "governance/evidence/history/sequence-0001/088cf8d37397d5d29443511f779217148745e329d102adf6a05c20a2a2c0a524.snapshot",
      "bytes": 1047,
      "sha256": "088cf8d37397d5d29443511f779217148745e329d102adf6a05c20a2a2c0a524",
      "media_type": "text/plain",
      "role": "governance_evidence"
    },
    {
      "path": "governance/evidence/history/sequence-0001/92d13fa5ec959e0a7b810b03e0373f4caebe1b85ce95f609e60384cdf5dfef16.snapshot",
      "bytes": 2805,
      "sha256": "92d13fa5ec959e0a7b810b03e0373f4caebe1b85ce95f609e60384cdf5dfef16",
      "media_type": "text/plain",
      "role": "governance_evidence"
    },
    {
      "path": "governance/evidence/history/sequence-0001/93c71bcc10bb3752dbea766861a67707325ea2f9a63338a9fbc8384ba3cf7841.snapshot",
      "bytes": 2286,
      "sha256": "93c71bcc10bb3752dbea766861a67707325ea2f9a63338a9fbc8384ba3cf7841",
      "media_type": "text/plain",
      "role": "governance_evidence"
    },
    {
      "path": "governance/evidence/history/sequence-0001/cb018f0db7097bed13fe2f61ad2607709b7413d8bfbdfaf2347dabfdfdae345f.snapshot",
      "bytes": 1028,
      "sha256": "cb018f0db7097bed13fe2f61ad2607709b7413d8bfbdfaf2347dabfdfdae345f",
      "media_type": "text/plain",
      "role": "governance_evidence"
    },
    {
      "path": "governance/evidence/history/sequence-0001/ec3febc9639cebfb69dbc4fb3cd0a4645c750e5b6f870319251d007126ce5d0f.snapshot",
      "bytes": 1307,
      "sha256": "ec3febc9639cebfb69dbc4fb3cd0a4645c750e5b6f870319251d007126ce5d0f",
      "media_type": "text/plain",
      "role": "governance_evidence"
    },
    {
      "path": "governance/r0/STATUS.md",
      "bytes": 3604,
      "sha256": "006a77e1793df3906319b1b7109b2420ecc149cf5aca7b0a8d53b6e000b66ae6",
      "media_type": "text/markdown",
      "role": "governance_status"
    },
    {
      "path": "governance/r0/bootstrap-envelope-policy.proposal.json",
      "bytes": 4111,
      "sha256": "ad5bcac7986a84b60accb0cbdb70c4f0cf9f259461164a9dc8131e26bc6e61eb",
      "media_type": "application/json",
      "role": "governance_policy"
    },
    {
      "path": "governance/r0/identity-boundary-policy.proposal.json",
      "bytes": 1307,
      "sha256": "ec3febc9639cebfb69dbc4fb3cd0a4645c750e5b6f870319251d007126ce5d0f",
      "media_type": "application/json",
      "role": "governance_policy"
    },
    {
      "path": "governance/r0/m-1-gate-definition.proposal.json",
      "bytes": 4909,
      "sha256": "fce11bfb49c288e5212d3261c3cc1fdfbe21ec8f227e3d06a9f3368564692166",
      "media_type": "application/json",
      "role": "governance_policy"
    },
    {
      "path": "governance/r0/r0-gate-definition.proposal.json",
      "bytes": 10701,
      "sha256": "c5ad55a22e3515d4e469f5dac6bed34163200f750b5f9916ab4f7d8f1159f930",
      "media_type": "application/json",
      "role": "governance_policy"
    },
    {
      "path": "governance/r0/ref-protection-intent.json",
      "bytes": 4564,
      "sha256": "5ab9e4515f9a194ce16b118c621d73cff279e9b575634203f66f2c69b89edd83",
      "media_type": "application/json",
      "role": "governance_policy"
    },
    {
      "path": "governance/r0/risk-policy.proposal.json",
      "bytes": 2359,
      "sha256": "83538f9883da949fcfafab2e96c0ebffdb09df8b7baf6aabbd61a46fc0b5ed7e",